guid	title	volume	spage	epage	year
10.26749/rphe1046	Note on Eucalyptus linearis, Dehnhardt - a supposed Tasmanian sepcies		79	80	1902
10.26749/avgs2634	Note on a species of Eucalyptus new to Tasmania		83	84	1902
10.26749/blry4853	Notes on Tasmanian conchology		77	78	1902
10.26749/uijk3321	Notes on some remarkable Tasmanian invertebrates		81	82	1902
10.26749/pzro1086	Notes on unrecorded and other minerals occurring in Tasmania		18	33	1902
10.26749/wjan9976	On Tenison-wood types in the Tasmanian Museum, Hobart		106	114	1902
10.26749/dexh1419	On certain calcareous nodules		136	137	1902
10.26749/wedf1839	Practical astronomy in Tasmania, and a proposal for a school thereof		85	94	1902
10.26749/tdhb8793	Presidential address delivered to the Royal Society of Tasmania, 1902		ii	iii	1902
10.26749/cwfe4404	Proceedings of the Royal Society for April, 1902		i	vii	1902
10.26749/jrpz5186	Proceedings of the Royal Society for August, 1902		xxvii	xxviii	1902
10.26749/rdat7595	Proceedings of the Royal Society for July, 1902		xxiii	xxvi	1902
10.26749/wrck8884	Proceedings of the Royal Society for June, 1902		xi	xxii	1902
10.26749/kspz5271	Proceedings of the Royal Society for May, 1902		viii	x	1902
10.26749/drye8736	Sewage purification and disposal		100	105	1902
10.26749/qhgh3113	Some additions to the Bryological flora of Tasmania - Part III		115	132	1902
10.26749/lutx5155	Suggestions for the establishment of a Tasmanian school of forestry and agriculture		1	15	1902
10.26749/qxwp9945	The Tasmanian timber indusry		35	71	1902
10.26749/qpno1695	Tasmanian timbers - Hobart prices		69	71	1902
10.26749/mzif6682	Tourmaline-bearing rocks of the Heemskirk district		144	156	1902
10.26749/dcmn6253	Trachydolerite in Tasmania		133	135	1902
10.26749/yazg6328	Typhoid in Hobart and Melbourne, and the influence of drainage on its prevalence		95	99	1902
10.26749/fwoy8905	Present and future prospects of timber in Tasmania		21	37	1901
10.26749/wnoh7939	Proceedings of the Royal Society for April, 1901		xiv	xvi	1901
10.26749/clpg5937	Proceedings of the Royal Society for the month of July 1901		xxii	xxiv	1901
10.26749/jpsf3053	Proceedings of the Royal Society for the month of June, 1901		xviii	xxi	1901
10.26749/pszp2989	Proceedings of the Royal Society for the month of May, 1901		xvii	xvii	1901
10.26749/ehfn8403	Proceedings of the Royal Society for the month of November, 1901		xxxiv	xxxix	1901
10.26749/odwm2002	Proceedings of the Royal Society for the month of September and October 1901		xxv	xxxiii	1901
10.26749/njhd4668	1901-1903 List of Additions to the Royal Society Library		lxv	lxv	1900
10.26749/jofr4685	Additions to Tasmanian flora		107	108	1900
10.26749/htct6726	Botany		85	89	1900
10.26749/qscl6495	Contents page for the years 1900-01				1900
10.26749/vcbd4209	Description and analysis of a new Species of mineral, petterdite, A new oxychloride of lead		51	52	1900
10.26749/pgbq8004	"Further notes on the ""permo-carboniferous fossil cliffs"" at Darlington, Maria Island"		11	22	1900
10.26749/ztmx9187	List of Papers presented at the Royal Society of Tasmania from 1903-1905				1900
10.26749/lkxc6195	Note on Itacolumite or flexible sandstone		134	140	1900
10.26749/wmoc1512	Note on hippomedon kergueleni, miers, an amphipod received from Cape Adare, South Victoria land		3	3	1900
10.26749/mosm6687	Note on the birds of Tasmania		90	101	1900
10.26749/tdfi4770	Obituary Notice for Sir James Agnew, R.S Bright and the Honourable C.H Grant		140	144	1900
10.26749/zhkt8356	Observations regarding the recent discovery by G. Thureau, F.G.S., of a fossil reptile in the Mersey coal measures at Railton		9	11	1900
10.26749/bgfz8852	On a meteorite from the Castray River		47	51	1900
10.26749/zfnp3892	On some land and aquatic shells from Maria island		1	2	1900
10.26749/ezsj9675	Outlines of the geology of Tasmania		58	74	1900
10.26749/wzmb4625	Practicable forestry in Tasmania and elsewhere		127	133	1900
10.26749/hxxr3032	Proceedings for the Royal Society for the month of September, 1900		ix	x	1900
10.26749/quxl4422	Proceedings of the Royal Society for May, 1900		i	ii	1900
10.26749/fbqr3132	Proceedings of the Royal Society for the month of August, 1900		iv	viii	1900
10.26749/lnlz3697	Proceedings of the Royal Society for the month of November, 1900		xiii	xiii	1900
10.26749/yycy6730	Proceedings of the Royal Society for the month of October, 1900		x	xii	1900
10.26749/gbcs9635	Return of the Antarctic expedition		115	128	1900
10.26749/ojxr8849	Some account of the work and workers of the Tasmanian Society and the Royal Society of Tasmania, from the year 1840 to the close of 1900.		109	126	1900
10.26749/uncw9578	Supplementary notes on some Antarctic rocks and minerals		38	41	1900
10.26749/wiis7691	Tasmanian Museum and Art Gallery extension. foundation-stone ceremony		xxxix	xliii	1900
10.26749/qsxd4923	Tasmanian diatomaceae		4	8	1900
10.26749/sukt3316	A further note on obsidian buttons		42	44	1900
10.26749/clxy2258	The glacial beds of Little Peppermint Bay, Tasmania		45	47	1900
10.26749/zjtn9206	The magnetic survey of Tasmania		81	88	1900
10.26749/shrx3054	The microscopic structure of some Tasmanian rocks		53	57	1900
10.26749/zjam1117	The minerals of Tasmania		75	84	1900
10.26749/ftdl4976	The recent mollusca of Tasmania		102	106	1900
10.26749/tplj9015	Annual meeting for the year, 1899		xxiii	xxvi	1899
10.26749/ltzg7550	The British Antarctic expedition		xvi	xxii	1899
10.26749/tddj5175	Death notice of Mr. James Backhouse Walker		lix	lx	1899
10.26749/ziyp3644	First meeting of the Historical and Geographical Section		liii	lvi	1899
10.26749/epxh2132	Proceedings of the Royal Society for the month of April, 1899		xxvii	xxxiii	1899
10.26749/dxfm4840	Proceedings of the Royal Society for the month of August, 1899		xli	xliv	1899
10.26749/dtxa7645	Proceedings of the Royal Society for the month of July, 1899		xxxviii	xl	1899
10.26749/qrxt3616	Proceedings of the Royal Society for the month of June, 1899		xxxvi	xxxvii	1899
10.26749/bbcw4893	Proceedings of the Royal Society for the month of May, 1899		xxxiv	xxxv	1899
10.26749/xfkd1773	Proceedings of the Royal Society for the month of October, 1899		li	lii	1899
10.26749/rqmn6801	Proceedings of the Royal Society for the month of September, 1899		xlix	l	1899
10.26749/ovmc2504	Sir James Agnew's 84th birthday		lvi	lvii	1899
10.26749/pawp6412	Additions to the fungus flora of Tasmania		97	99	1898
10.26749/nyug9421	Are all the colossal igneous caps of the Tasmanian tiers and of the lofty mountain plateaux true sills?		xLix	Lii	1898
10.26749/uaft3468	Botanical notes		103	105	1898
10.26749/ppwy7573	Contents pages for the Royal Society of Tasmania, 1898-1899		1	07	1898
10.26749/epek2816	Description and measurement of some Mallicolo crania		106	114	1898
10.26749/llgl7662	Forestry for Tasmania		liii	lvii	1898
10.26749/elfv8860	List of the Tasmanian shells in the Tasmanian Museum collection, with the names of many species that are not yet represented therein.		xLix	Lii	1898
10.26749/qeci2530	Nepheline and Melilite rocks from Shannon Tier		60	64	1898
10.26749/hgtc2167	Note on the humeri of Tasmanian Labyrinthodonts		27	31	1898
10.26749/piqe9565	"Notes on a ""Fayalite Basalt"" from One Tree Point"		77	80	1898
10.26749/peor3772	Notes on a fossil wood from Cox's Bight		85	87	1898
10.26749/cubh8726	On Hauyne-Trachyte and allied rocks in the districts of Port Cygnet and Oyster Cove		3	26	1898
10.26749/fpir7329	On Mesozoic Dolerite and diabase in Tasmania		47	55	1898
10.26749/ojra3417	On a new Cordiceps		100	102	1898
10.26749/uvzw4740	On the Felsites and associated rocks of Mount Read and vicinity		33	46	1898
10.26749/ogxr2863	On the genus Kraussinna in Tasmania		88	91	1898
10.26749/zyad6319	On the occurrence of a new species of Garnet at Port Cygnet		74	76	1898
10.26749/dzxo7814	Proceedings of the Royal Society for the month of August, 1898		ix	xiv	1898
10.26749/nxre9195	Proceedings of the Royal Society for the month of July, 1898		vii	viii	1898
10.26749/viwr6799	Proceedings of the Royal Society for the month of June, 1898		iv	vi	1898
10.26749/dspf8208	Proceedings of the Royal Society for the month of May, 1898		i	iii	1898
10.26749/dcqc7333	Proceedings of the Royal Society for the month of October, 1898		xv	xv	1898
10.26749/zmml4088	Supplementary note on Limurite in Tasmania		1	2	1898
10.26749/fhiu4665	Supplementary note on Limurite in Tasmania		56	59	1898
10.26749/wiab4324	The Tasmanian aborigines		65	73	1898
10.26749/dzib9376	Tasmanian species of Halysites		81	84	1898
10.26749/cqcz9157	Annual meeting for the year, 1897		i	ii	1897
10.26749/kcrr8075	Application of the Hare system in Tasmania		79	91	1897
10.26749/cmsv1144	Contents page for the year, 1897				1897
10.26749/xxkq1161	Descriptions and measurements of some Maori and Moriori crania		111	118	1897
10.26749/vsim5263	Disposal of our dead by cremation		13	23	1897
10.26749/nnhn2806	Iron depositis of Tasmania		49	53	1897
10.26749/nyen6047	Land routes for exploration of the western country		189	196	1897
10.26749/maic2225	List of bound volumes and unbound pamphlets and magazines donated to the Royal Society of Tasmania in the year 1897		xxv	xxix	1897
10.26749/nzik2199	List of valuable scientific books donated to the Royal Society of Tasmania from the British Museum in the year 1897		xxii	xxiii	1897
10.26749/msvm6184	"Notes on a specimen of Basalt-glass (Tachylyte) from near Macquarie plains Tasmania, with remarks on Obsidian "" Buttons."""		54	58	1897
10.26749/vjbs7049	Notes on coral reefs, with special reference to the funafuti borings		92	96	1897
10.26749/meva8739	Notes on some recently discovered and other minerals occurring in Tasmania		62	65	1897
10.26749/rvbp6339	Notes on the Mount Dundas narrow gauge railway		7	12	1897
10.26749/cxod3399	Notes on the aborigines of Tasmania, extracted from the manuscript journals of George Washington Walker, with an introduction by James B. Walker, F.R.G.S.		145	175	1897
10.26749/icif9905	Notes on the measurements of the Tasmanian crania in the Tasmanian Museum, Hobart		97	107	1897
10.26749/idtj9188	Observations on the working results of the hare system of election in Tasmania		69	96	1897
10.26749/tlym7470	On Trithuria filamentosa		47	48	1897
10.26749/nedb5939	On some Igneous rocks from the Heazlewood District		24	38	1897
10.26749/axml6443	On the occurrence of Limurite in Tasmania		1	6	1897
10.26749/eyuu2265	On the occurrence of Spherulitic Felsite on the West Coast of Tasmania		59	61	1897
10.26749/wkzc1372	On the topaz quartz porphyey or stanniferous elvan dykes of Mount Bischoff.		119	128	1897
10.26749/niuo7507	Proceedings of the Royal Society for the month of August, 1897		ix	x	1897
10.26749/ftlj9231	Proceedings of the Royal Society for the month of July, 1897		vi	viii	1897
10.26749/ekjk6938	Proceedings of the Royal Society for the month of May, 1897		vi	viii	1897
10.26749/xxha3997	Proceedings of the Royal Society for the month of November, 1897		xvi	xxi	1897
10.26749/djnl6714	Proceedings of the Royal Society for the month of October, 1897		xii	xv	1897
10.26749/oaxb7753	Proceedings of the Royal Society for the month of September, 1897		xi		1897
10.26749/ngwt5444	Some notes on the tribal divisions of the aborigines of Tasmania		176	187	1897
10.26749/rodc3304	Tasmanian Birds : on Mr. A.J. North's book re Tasmanian Birds		66	68	1897
10.26749/ixqf8781	Tasmanian fungi		129	144	1897
10.26749/vmmd2210	Antennarius mitchellii Sp. Nov.		98		1896
10.26749/smtn3764	A Classified list of the minerals species known to occur in Tasmania		23	26	1896
10.26749/mxdp9086	Contents page for the year 1896				1896
10.26749/fywm8967	Description of a small collection of Tasmanian Silurian fossils presented to the Australian museum by Mr. A. Montgomery, M.A., Government Geologist, Tasmania		29	46	1896
10.26749/kyqo7122	Health of Hobart		1	21	1896
10.26749/fksb1660	Lampris		100		1896
10.26749/oeva9280	Microscopical studies of Tasmanian rocks		89	96	1896
10.26749/wofc3235	Notes on the effects of the atmosphere on the shells of mollusca		88		1896
10.26749/qzii9076	Notes on the identification of the black Cockatoo (Calyptorhynchus xanthonotus)		100		1896
10.26749/blly6831	Proceedings of the Royal Society for the month of August, 1896		x	xvi	1896
10.26749/iqnh1069	Proceedings of the Royal Society for the month of June, 1896		v	ix	1896
10.26749/cwes3743	Proceedings of the Royal Society for the month of May, 1896		i	iv	1896
10.26749/dgov9078	Proceedings of the Royal Society for the month of November, 1896		xxii	xxviii	1896
10.26749/ndhe6104	Proceedings of the Royal Society for the month of October, 1896		xvii	xxi	1896
10.26749/lxlr6623	Proceedings of the Royal Society for the month of September, 1896		xv	xvii	1896
10.26749/xstq4019	Some Tasmanian fishes		69	84	1896
10.26749/olxr6486	Some conchological notes on Tasmanian mollusca		87		1896
10.26749/eohv3342	Tuberculosis		45	68	1896
10.26749/qbmq2433	Voulta fusiformis, Swainson, Var. Micro-papillosa		86		1896
10.26749/thfq7207	The death of Baron Ferd. Von Mueller, October 1896		xviii	xix	1896
10.26749/gyea3434	Abel Jansoon Tasman. His life and voyages (maps)				1895
10.26749/sxgw8319	Botanical notes		102	104	1895
10.26749/vusq7419	Botany of the Hartz and Adamson Ranges		64	67	1895
10.26749/uemg4932	Contents page for the year 1895				1895
10.26749/rzto6071	Discussion on R.M. Johnston's paper		98	101	1895
10.26749/lzyo5530	Further contributions to the history of the fossil flora of Tasmania. Part II		57	63	1895
10.26749/hnqn9815	Note on timber found beneath alluvial drift at Swansea		68	69	1895
10.26749/ueeo7081	Notes on a mineral substance new to Tasmania		xx	xxi	1895
10.26749/yttv6060	Notes on further proofs of glaciation at low levels		73	77	1895
10.26749/tzvs4629	Notes on further proofs of glaciation at low levels		xxi		1895
10.26749/yopr2253	"Notes on the occurrence in Tasmania of the ""Southern stone plover"" (Edicnemus grallarius)"		71	72	1895
10.26749/jjag5674	On the new genus Petterdiana		105		1895
10.26749/qzmd4647	On the occurrence of the fantailed cuckoo (Cuculus flabelliformis) in Tasmania		70		1895
10.26749/cnhx8294	Primary law of value or price		78	97	1895
10.26749/bdqd5992	Proceedings of the Royal Society for the month of August, 1895		xxii	xxiv	1895
10.26749/oshd5389	Proceedings of the Royal Society for the month of May, 1895		xx	xxi	1895
10.26749/yhaz3785	Proceedings of the Royal Society for the month of November, 1895		xxxii	xxxiii	1895
10.26749/pocy3937	Proceedings of the Royal Society for the month of October, 1895		xxvii	xxxi	1895
10.26749/lnwk1963	Proceedings of the Royal Society for the month of September, 1895		xxv	xxvi	1895
10.26749/kfwb6514	Some additions to the moss flora of Tasmania. Part II		106	120	1895
10.26749/typb6854	Ancient wrecks and relics of European vessels on Australian coasts		xii		1894
10.26749/lunl2749	Antarctic exploration		42	50	1894
10.26749/taws5169	Botanical notes		51	54	1894
10.26749/utme5553	Contents page for the year 1894				1894
10.26749/fwbi6940	Early voyages to Papua, 1511 to 1545		xvii		1894
10.26749/tbdt5380	Further discoveries of glaciation, west coast, Tasmania		56	65	1894
10.26749/ilwx7938	The Gothenberg system		i	ii	1894
10.26749/tljo4209	Meridian observations with the Hobart transit instruments		vi	ix	1894
10.26749/ymdu9324	Note on an early chart showing the tracks of Tasman's voyages in 1642 and 1644		27	33	1894
10.26749/vkqr3322	Notes on a new species of pedalion found in the Solomon Islands		40	41	1894
10.26749/yaxc8796	Notes on a recent trip to the Hartz Mountains		xix		1894
10.26749/kvwq7838	Notes on some Ouse River fossil impressions		ii		1894
10.26749/cmnh4873	Notes on some Tasmanian chitons		34	39	1894
10.26749/wevb1266	On a new centrolepideae		55		1894
10.26749/ogrd6702	Primitive theories of political teaching		xviii		1894
10.26749/rjgz6330	Proceedings of the Royal Society for the month of April, 1894				1894
10.26749/kiql6303	Proceedings of the Royal Society for the month of August, 1894		xiii	xv	1894
10.26749/wyba5268	Proceedings of the Royal Society for the month of July, 1894		x	xii	1894
10.26749/ngvy8549	Proceedings of the Royal Society for the month of June, 1894		vi	ix	1894
10.26749/jpyf3289	Proceedings of the Royal Society for the month of May, 1894		iii	v	1894
10.26749/tgmi9727	Proceedings of the Royal Society for the month of October, 1894		xviii	xix	1894
10.26749/jicp5736	Proceedings of the Royal Society for the month of September, 1894		xvi	xvii	1894
10.26749/dxwi9530	Tasmanian earthquakes of 1892		v		1894
10.26749/ykek3174	Tasmanian timbers - their commercial uses and preparation for market		x	xii	1894
10.26749/tata1088	The deportation of the Norfolk Islanders to the Derwent in 1808		1	26	1894
10.26749/vmgc9271	A new method of dropping the time ball		xviii		1894
10.26749/lewp2253	The protection of mutton birds and seals		xiii	xiv	1894
10.26749/unfy2463	Botanical notes		179	186	1893
10.26749/hwcv6985	Catalogue of the minerals known to occur in Tasmania, with notes on their distribution		1	72	1893
10.26749/yynl6945	Contents page for the year 1893				1893
10.26749/fntj5744	Description of a new species of shark		211	213	1893
10.26749/hoen5674	Discovery of glaciation in the vicinity of mount Tyndall, in Tasmania		147	149	1893
10.26749/iemw6145	Evidences of former glaciation in the Southern- hemisphere (Australia, New Zealand, and Tasmania) subsequent to the deposition of rocks of Miocene Age		81	134	1893
10.26749/wftd1588	Further contributions to the fossil flora of Tasmania		170	179	1893
10.26749/wegz1082	Geology of the Lake St. Clair district		150	158	1893
10.26749/ckqf5915	Glacial action in Tasmania		159	169	1893
10.26749/ixgi1663	Notes on Tasmanian lichens		214	219	1893
10.26749/owth8234	Notes on the Mount Lyell mine		194	199	1893
10.26749/fgmm4196	Notes on the geology of lake St. Clair and its immediate neighbourhood, together with observations regarding the probable origin of our numerous Tasmanian lakes and tarns		135	146	1893
10.26749/jihu8783	Proceedings of the Royal Society for the month of April, 1893		i	iii	1893
10.26749/tbqe3876	Proceedings of the Royal Society for the month of August, 1893		xviii	xxii	1893
10.26749/bncb5246	Proceedings of the Royal Society for the month of July, 1893		xiiii	xvii	1893
10.26749/jeoo4362	Proceedings of the Royal Society for the month of June, 1893		ix	xii	1893
10.26749/nzib9161	Proceedings of the Royal Society for the month of May, 1893		iv	viii	1893
10.26749/qqra6606	Proceedings of the Royal Society for the month of November, 1893		xxv	xxvi	1893
10.26749/uarb1774	Proceedings of the Royal Society for the month of September, 1893		xxiii	xxiv	1893
10.26749/zbwb9565	Proposed Coniferae plantations		xix	xxi	1893
10.26749/vxwu1695	Remarks upon the disposal of the sewage of Hobart		188	193	1893
10.26749/yfmj2968	Some additions to the moss flora of Tasmania		200	210	1893
10.26749/unby2853	A recent visit to Norfolk Island		iv	viii	1893
10.26749/nqio2004	Additions to Tasmanian flora, II		82	83	1892
10.26749/iifb7163	Concerning various means of encouraging the study of natural history in Tasmania		85	87	1892
10.26749/uqlk1960	Contents page for the year 1892				1892
10.26749/egmk5331	"Note on a Tasmanian ""Acanthiza"""		77	78	1892
10.26749/iuax6389	Note on the occurrence of some Australian Arcleidae in Tasmania		79	81	1892
10.26749/gxhy5701	Note on the voracity of the Kelp fish		78		1892
10.26749/keqm3210	Notes on Tasmanian Crustacea, with descriptions of new species		45	76	1892
10.26749/ibqx3465	Notes on some plants new to Tasmanian		92	93	1892
10.26749/ebyi8633	Notes on the natural limits to occupation on the land		1	8	1892
10.26749/rvkk9927	On new species of Tasmanian Aeanae		94	129	1892
10.26749/bbfe2141	On the classificatory position and synonyms of Eatoniella rufilabrtis		88	91	1892
10.26749/lpix8474	On the proposed Leake school of practical astronomy		26	31	1892
10.26749/hufw8720	Proceedings of the Royal Society for the month of April, 1892		i	vi	1892
10.26749/puad4228	Proceedings of the Royal Society for the month of August, 1892		xii	xvii	1892
10.26749/odml2257	Proceedings of the Royal Society for the month of June &amp; July, 1892		xi	xii	1892
10.26749/nvbv2983	Proceedings of the Royal Society for the month of May, 1892		vi	xi	1892
10.26749/mvvb2163	Proceedings of the Royal Society for the month of November, 1892		xviii	xxxv	1892
10.26749/zdiz3920	Proceedings of the Royal Society for the month of September, 1892		xviii		1892
10.26749/tzmv5430	"Remarks on Sir Robert Ball's paper (Read at the Hobart meeting of the Australasian Science Association), entitled : "" The astronomical explanation of a glacial period."""		21	25	1892
10.26749/ttym9807	Report of the Royal Society for the year 1892		1	17	1892
10.26749/ioch8600	Tasmanian apples in London		ii	vi	1892
10.26749/lcvg7217	Tasmanian lichens - Part 1		133	178	1892
10.26749/xnma5947	Trade unionism as a factor in social evolution		32	43	1892
10.26749/lnme6504	What are the conditions which determine the just and equitable representation of the people?		09	21	1892
10.26749/rlxn6157	The climate of eastern Tasmania indicated by its lichen flora		131	132	1892
10.26749/owpx1570	A list of the known lichens of Tasmania		179	190	1892
10.26749/lxul3062	The use of the womerah, or ‘ throw stick’ by the aborigines of Tasmania		84	31	1892
10.26749/nyac6491	Brief remarks on some rare Tasmanian plants		14	17	1891
10.26749/hfex1565	Electric traction		72	88	1891
10.26749/rouj9002	Hypnotosm and allied phenomena		61	71	1891
10.26749/wjrm3768	Notes on a collection of plant impressions from the Henty River - Lower Coal Measures		11	13	1891
10.26749/wjzs1866	Notes on the Mount Lyell District		25	43	1891
10.26749/opew1369	Notes on the shell - mounds at Seaford, Little Swanport		89	94	1891
10.26749/egrc5153	Observations on the causes of elevation and subsidence of the earth's crust		49	58	1891
10.26749/emli9264	Proceedings of the Royal Society for the month of April, 1891		i	iv	1891
10.26749/drju5948	Proceedings of the Royal Society for the month of August, 1891		xii	xx	1891
10.26749/eqrz9631	Proceedings of the Royal Society for the month of June, 1891		viii	xi	1891
10.26749/mlgm9893	Proceedings of the Royal Society for the month of May, 1891		v	vii	1891
10.26749/gvpu6068	Proceedings of the Royal Society for the month of October, 1891		xxiv	xxvii	1891
10.26749/pfdm3426	Proceedings of the Royal Society for the month of September, 1891		xxi	xxiii	1891
10.26749/fsws2438	Report of the Royal Society of Tasmania for the year 1891		1	15	1891
10.26749/suud2828	Some account of the mutton birds, or Sooty petrels (Nectris brevicaudus), as seen in their homes among the Furneaux Islands, Bass Straits, Tasmania, from notes taken during a visit to the locality in March, 1891.		1	10	1891
10.26749/gsjk2963	Total eclipse of the moon, 24th May, 1891, observed at Launceston		44	45	1891
10.26749/wdvu1287	A note on the arithmometer as an aid to actuarial work		59	60	1891
10.26749/rysa6192	The possibility of the telescope		18	24	1891
10.26749/eftx9751	The transit of Mercury, May 10, 1981		46	48	1891
10.26749/fbyu3687	Additions to the list of Tasmanian fossils of upper Palaeozoic age		137	141	1889
10.26749/gxxr9635	Australian and Tasmanian Sandarach		55	59	1889
10.26749/yoqs9911	Contents page and index for the year 1889				1889
10.26749/psig1544	Detention of Flinders at the Mauritius.		121	124	1889
10.26749/ermh5779	The English at the Derwent, and the Risdon settlement.		65	89	1889
10.26749/bxrt1931	Expedition under Lieutenant-Governor Collins in 1803-4		205	222	1889
10.26749/jxge9819	Foraminifera in upper palaeozoic rocks		54	54	1889
10.26749/wwvm1246	"""Iron Blow"" at the Linda goldfield"		21	28	1889
10.26749/sfbr7111	Macquarie Harbour leaf beds		53		1889
10.26749/hebu4425	Note on the Australian Curlew and its closely allied congeners		133	136	1889
10.26749/ckms8693	Notes on Angora goat farming		31	38	1889
10.26749/vnna6075	"Notes on a case of poisoning through eating a portion of the "" Brugmansia.""."		29	30	1889
10.26749/bpsk4240	Notes on charts of the coast of Tasmania, obtained from the hydrographical department, Paris, and copied by permission of the French government		107	120	1889
10.26749/ewdr8846	Notes on the discovery of a Ganoid fish in the Knocklofty sandstones, Hobart		102	104	1889
10.26749/qthk1603	Notes on the last living Aboriginal of Tasmania		60	64	1889
10.26749/pcqy5318	Notes on the possible oscillation of levels of land and sea in Tasmania during recent years		18	20	1889
10.26749/gcnm8347	Observations regarding pyramid numbers		125	132	1889
10.26749/opcz9873	On some tide observations at Hobart during February and March, 1889		8	12	1889
10.26749/ewop1339	On the encouragement of a more general interest in scientific pursuits		13		1889
10.26749/izmo1292	Proceedings of the Royal Society for the month of April, 1889		vi	viii	1889
10.26749/vzkc2886	Proceedings of the Royal Society for the month of August, 1889		xvii	xx	1889
10.26749/etcz1332	Proceedings of the Royal Society for the month of July, 1889		xiii	xvi	1889
10.26749/gpdq9962	Proceedings of the Royal Society for the month of May, 1889		vi	viii	1889
10.26749/ndwe7135	Proceedings of the Royal Society for the month of November, 1889		xxxiii	xxxviii	1889
10.26749/lwqf3262	Proceedings of the Royal Society for the month of September, 1889		xxi	xxx	1889
10.26749/fnsx1545	Protection of Tasmanian owls		40		1889
10.26749/osrz2091	Protection of the Cape Barren goose		41	42	1889
10.26749/djtm1145	Root matters in socieal and economic problems		142	204	1889
10.26749/xnnt7979	Smut in wheat		95	97	1889
10.26749/rksb4372	Smut in wheat		92	94	1889
10.26749/kdax3531	The founding of Hobart by Lieutenant Governor Collins		223	248	1889
10.26749/isfh4374	"The ""iron blow"" at the Linda goldfield"		1	07	1889
10.26749/iiqb3064	A new dark-field micrometer for double-star measurement		98	101	1889
10.26749/fpgp8174	A preliminary critique of the Terra Australis legend		43	52	1889
10.26749/rzqc1823	Concise history of the acclimatisation of the Salmonidae in Tasmania		1	26	1888
